,text,label
0,I want to cancel a transaction from this morning.,8
1,What do I do if I think someone has used my card?,22
2,How do I change my address ?,30
3,Does auto top-up have a limit?,4
4,The ATM did not give me as much cash as I requested.,75
5,Is there a way to make my money usable in another country?,33
6,The top-up did not go through.,59
7,Will there be a fee to receive a physical card?,43
8,I was told I would be getting a refund but I have yet to see it,51
9,"I lost my phone, what should I do?",42
10,I can't find how to top up my account with a check.  Where is that?,58
11,Can I check my recent refund in my statement?,51
12,Is the PIN sent in another message?,38
13,Why did I not get the amount I specified at the ATM?,75
14,can you share card tracking number?,11
15,I didn't set up a direct debit payment on my account.,28
16,Can I use this app for any currency?,54
17,"Why did I get charged a fee, I thought it was free?",19
18,The app failed to verify my id.,68
19,I am unable to use my card.,14
20,I need to transfer some money to a friend who is in urgent need of some fast cash. How long will it take before she can use that money?,66
21,I need to freeze my card. There are charges on there that i did not authorize. They've been coming out for a couple of days. Can i get this money back?,16
22,Can I order a card?,43
23,What is the charge for using a Top up card in the US?,57
24,While on vacation I used an ATM to get cash and was overcharged. These charges are ridiculous and had I known about them I would have never used it.,76
25,"I would like to close my account, as I'm not happy.",55
26,My payment card was declined - could you tell me why?,25
27,I paid with my card and was charged extra,15
28,Why is there a charged fee for debit or credit card payment?,15
29,I am missing my refund.,51
30,How do I check security settings on my card?,14
31,"I just looked at my app and it seems I was charged extra, why is that?",34
32,I just had a look at my statement. Why have I been changed for using the ATM?,19
33,Is there a fee to make a transfer?,56
34,What I topped up was reverted by the app.,61
35,My cash deposit from a week ago is still not in my account. Can you help me please?,6
36,Why am I getting declines when trying to make a purchase online?,27
37,I placed a cheque but the funds aren't there,6
38,I have a charge for something I didn't buy.,16
39,"I have a transfer from the US, How long is the wait?",67
40,What do I do to verify a top-up?,71
41,I can't do any business with this virtual card.,72
42,I have yet to receive my virtual card,40
43,"I topped up recently and saw the money go through, but now it's just gone? What's going on",61
44,my virtual card has not came yet!,40
45,"I have never been charged for making an ATM cash withdrawal before, but I am now being charged a fee to withdraw cash. What happened?",19
46,Is there a reason why a recipient might not see my money transaction,66
47,I noticed an extra fee when I paid with my card.,15
48,My salary is in GBP. Do I need to configure this somewhere?,50
49,Why can't I top up by cheque?,58
50,How do I create a disposable virtual card?,37
51,What should I do if I think someone is using my card without my permission?,22
52,Why is this not letting me exchange crypto? I need help making this transaction go through.,7
53,Can you tell me how transferring money into my account works?,65
54,Why  am I being told this  transfer will not  go thru,7
55,Where can I order a card when I am in China?,9
56,A transaction on my card shows as pending.,45
57,What is the delivery time to the US?,12
58,What do I need to see my source of money?,70
59,Do I need to use a limit on top-ups?,60
60,My card has been stolen what do I do?,41
61,How to cancel a transaction,8
62,Earlier today I took money out the ATM. After checking the app the amount is so much higher than the amount I received.,75
63,Does this app exchange currencies?,33
64,how to i go about getting my virtual card,40
65,I've lost my card. What can I do about that?,41
66,Can I withdraw money in my hometown currency while on holiday without any additional fees?,76
67,What about a auto top-up?,4
68,Why on earth is the exchange rate so bad?   Can I get a rate closer to the actual interbank rate?,17
69,I deposited a cheque but I don't see the funds in my account.,6
70,How do I update my address?,30
71,"My phone was stolen yesterday, can you help me with this?",42
72,I can't figure out how to transfer money into my account.,65
73,What information do I need to gather in order to activate my card?,0
74,I received my salary in the wrong currency. How do I change this?,50
75,I tried to use the ATM with foreign currency. The conversion rate applied was wrong.,76
76,How long does it take for money to reach my account?,5
77,Am I able to do a SWIFT transfer with you?,56
78,I may have entered the PIN wrong and the account is blocked.  What do I have to do to get it unblocked.,49
79,i cannot get virtual card to work,72
80,Which currencies do you work with?,54
81,Is it possible to exchange currencies on the app?,33
82,How can my new card be renewed?,0
83,i put money on my card and i dont see it on the balance,47
84,Do I need to pay extra for exchanging currencies?,31
85,Guide me on how to unblock my PIN,49
86,My friends would like to add to my account. What is the procedure?,62
87,The bank machine didn't give my card back how do I get a new one fast?,18
88,Why didn't my top up work?,61
89,What do I do if I still have not received my new card?,11
90,Since I just got married I need to change my name.,30
91,Why can't I transfer money to a beneficiery?,7
92,i am under 18 and i am trying to verify my id. why wont it work?,68
93,Where can I get your exchange rates from?,32
94,Why is my cash withdrawal pending?,46
95,The amount of cash I selected to withdraw is different than what I received.,75
96,What should I do if I think that someone might be using me card?,22
97,When will my card be delivered?,12
98,Can other people top up my account?,62
99,"I see in the app some cash was withdrawn, but it's not mine.",20
100,What is my source of funds?,70
101,"I recently purchased something, and the exchange rate was wrong.",17
102,Can I use my card anywhere?,10
103,My client was converting their Russian ruble into UK pound currency when they noticed their bill was much too high for the exchange. What happened?,17
104,I think there is a mistake.  I am being charged twice.,63
105,Where is a ATM that accepts Mastercard?,3
106,Hi. I noticed I have a duplicate charge which I have not made twice. Who should I talk to take care of this?,63
107,Where's my top up code?,71
108,Can an apple watch be used to tup-up?,2
109,Help! I lost my card!,41
110,Your company is lame. Shut down all my account services right now.,55
111,"I need to know this, where do my funds come from?",70
112,"How long do EU transfers actually take? I bought something online a couple days ago, sent the money immediately online but the seller says it's still not there yet.",48
113,I can't get into the app with the passcode.,44
114,"I made a transfer for my rent payment about 2 days ago, but my landlord hasn't received it yet. It shows as done on my  side, and I've double check all account numbers and they are correct. Can you verify that the transaction was actually made?",66
115,Tell me what ATMs take this card.,3
116,I noticed a charge for a transfer.  Why is this?  Is it because I did an international transfer?,64
117,Please tell me how to get a card if I reside in the US.,24
118,"My card has not been delivered yet and its been a week since I ordered it, please help",11
119,What do you need for the identity verification,69
120,I got a strange fee when I used the ATM.,19
121,"How long do EU transfers actually take? I recently bought something online a few days ago, sent the money immediately online but the seller says it's still not there yet.",48
122,Can you please help me in canceling my order.,52
123,There are a couple payments with my card shown that I'm not responsible for. What is going on? Maybe someone has access to my account.,16
124,"I got my card now, how do I make it show up in the app?",13
125,"In the app, where do I find my card PIN?",38
126,Is it possible to transfer money to my credit card?,62
127,I am upset with your service.  Please delete my account.,55
128,"Why is my transfer appearing as ""pending""?",48
129,what cards can i use to add money to my account,54
130,is it possible to top-up with google pay.,2
131,I withdrew cash and was charged. Why?,19
132,Can I use my account before my Identity verification has passed?,74
133,How do I verify my source of funds?,70
134,I was charged twice for a few things this week when I only bought one. What do I do?,63
135,How do I fix a broken card?,14
136,Why did I get a different card then requested?,73
137,Why was I charged a higher exchange rate when I bought something abroad?,17
138,Can my children get an account?,1
139,How long do you have to wait to see your virtual card your ordered?,40
140,Looks like my top up failed.,59
141,There is a duplicate charge on my account.,63
142,Can you convert to EUR?,36
143,How long does it take to get a refund on something I bought?,52
144,How do I get selected for a visa card?,73
145,My card was stolen. What do I need to do?,41
146,What is the handling fee for transfer?,56
147,For what reason can I not transfer money to a beneficiary?,7
148,how much is it to exchange currency,31
149,I would like to reactivate my card that I previously reported lost. I located the card this morning.,13
150,My Google pay top up isn't working. Help.,2
151,"I froze my account, but how do I order a replacement card?",22
152,"It has been a couple of hours but I do not see my balance updated, can you help?",5
153,I need help proving that this is really me and to verify my identity.,68
154,I didn't cancel my card payment.,53
155,I want to terminate my account,55
156,"I'd lke my card reactivated, I was thinking it was misplaced but I discovered when I woke up that I had left it in my coat.",13
157,What is the way to go about getting a virtual card?,40
158,A transaction posted twice to my account.,63
159,Can you please explain why my beneficiary is not allowed?,7
160,Can I dispute a debit payment that I am seeing that I didn't make from a couple of months ago?,28
161,"Hello, there was an error while attempting top-up with my card this morning. I was able to use the card two days ago with no issues. Could you please assist?",59
162,"I was out today looking forward to paying with my new card, turns out the payment kept getting declined. This is really sad, what's going on?",25
163,How much is it to send out additional cards?,39
164,I don't want to use this method to identify myself.,74
165,Can you help me? I have a duplicate transaction on my account and I don't understand why.,63
166,I had to pay a fee when buying items with my card.,15
167,I purchased something about one to two weeks ago but for some reason the payment was returned to my account today even though I've already received one of the items. Can you tell me what's going on?,53
168,My transfer was declined. Why did this happen?,27
169,"If I want to be able to give my daughter a card for my account, would I be allowed to get one for her?",39
170,Why is my transfer taking so long to complete?,66
171,Seems like my top-up has been cancelled,61
172,"The activation process did not work, please help?",0
173,What do i do if the exchange rate was wrong for the item i bought overseas?,17
174,why have i not got my new card?,11
175,I think there's been an unauthorized cash withdrawal from my account.,20
176,I see a direct debit payment on my statement that wasn't me,28
177,I'm looking for a machine of yours that will provide me cash from my home country. I went on holiday and don't have any cash on me. Will your machine charge me extra to do this?,76
178,How do I change my name?,30
179,"I needed cash today, so I used another provider's ATM, and when I attempted to withdraw, it declined. I just checked it out and I'm still showing my account with that amount pending! I didn't take any money out, it was declined, so I don't want that to be processed as a withdrawal.",46
180,I want a refund on the things i bought,52
181,I made a cash deposit to my account but it is not there,6
182,Does it cost extra to exchange foreign currencies?,31
183,"I tried to access money earlier but the machine seems not to be working. After looking, the transaction actually shows to still being process. Can you find out what is going on here? I don't want to be charged for some money I never got.",46
184,How do I set up an account for my children?,1
185,Can you please disable my current account.,55
186,I thought you guys offered free transfers. Why was I charged?,64
187,What are the steps for changing my passcode?,44
188,It didn't give me my cash,75
189,"I think someone might have a copy of my card because a 500 dollar withdrawal was made, and it wasn't me. Can you please help?",20
190,What's the limit for disposable virtual cards?,29
191,"So, I am in the middle of purchasing a flat. I need the money for the first mortgage payment and it is not going through. I keep receiving an error. Can you find out what's going on and help me complete this transfer?",35
192,how come when i asked for 100 it only gave me 20.00 in the app,75
193,Why am I unable to verify my id?,68
194,The card payment I made didn't work.,25
195,Can you send me more cards for my account?,39
196,Can I track the card that you sent me in the mail?,11
197,Do I have to manually top up once I'm too low?,4
198,I'm happy with Mastercard and want to stick with just that credit card.,73
199,IS there anywhere that a card cannot be delivered?,43
200,How do I add money to my card?,62
201,"I'm currently not in possession of my phone, is it still possible to go about things normally without access to the app?",42
202,Anytime I've made an ATM withdrawal before it has always been free. I now say that I have been charged for my most recent ATM withdrawal. What's going on here?,19
203,I finally got my card.  Now I want to link it.  Is that something you have to do or can I do that?,13
204,How do I discontinue my account?,55
205,Why is there a fee for cash withdrawal?,19
206,I have been double charged,63
207,Tell me how a top up would be reverted.,61
208,The bank charged me fees for withdrawing cash!,19
209,How do I authenticate my top-up?,71
210,Why are my purchases from this morning still pending?,45
211,I received the wrong amount of cash.,75
212,"Card payment was declined, do you know why?",25
213,how should i add money to my card,57
214,My balance didn't change after I transferred some money.,5
215,Can I have more than one card?,39
216,A refund is taking too long.,51
217,I'm suddenly getting an error while attempting a transfer that it isn't possible. Why? I've done it before.,7
218,What do I do?  My card is broken.,14
219,Would I be able to use SWIFT transfers?,56
220,Is there a fee for transferring money,64
221,why is there a fee for the transfer I made?,64
222,I was recently mugged and would like to know if I have to have access to the app to use your services and how I would go about setting up your services on a new device belonging to a current user?,42
223,i noticed that the funds were returned to my bank account. What happened?,61
224,Why was I charged extra when transferring?,64
225,"Hi, during online shopping payment is getting declined yesterday and today as well. Please check the issue.",27
226,I took out money and there is a fee.  Why?,19
227,Did a card payment that I made get cancelled?,53
228,I have a disposable virtual card. Is there a limit to how many times I can use it?,29
229,"I made a transfer and the receiver did not get the right amount its lesser than what it should be,Now I have to transfer more money to make up for the missing amount . Can you please help me about this, what should be done",64
230,What is the best way to get my virtual card?,40
231,It kept my cash,75
232,Can I top up my account with Google Pay?,2
233,"My card was lost on vacation, I don't know where it is. Can you help me take care of this immediately?",41
234,"Hi, I tried to top up my card today and it did not work. I have tried it in the past and it worked just fine but it won't do it anymore. Can you help me out?",59
235,I don't understand why there is an extra €1 fee in my statement.,34
236,Why doesn't my passcode work?,44
237,I have one other credit card from the US. Do you take that?,54
238,Do you have any fees if I want to add money using an international card.,57
239,Can I have a new card shipped to China?,9
240,There is random cash in my account.,20
241,My bag got stolen with all my cards. Can you please cancel my card and send a new one?,41
242,I don't recognize this withdrawal on my statement,20
243,am suspicious of my card's security,22
244,There has a recent suspicious withdrawal on my bank account. Is it possible to freeze my card?,20
245,How can i reset my passcode ?,44
246,I went to do a transfer and it was declined.,27
247,"Everything I have was stolen yesterday making it so I don't have access to the app, what should I do?",42
248,What should I do if my physical card isn't working?,14
249,My card won't physically work.,14
250,Does it cost money to top up?,57
251,Is there a limit to a disposable virtual card?,29
252,"I tried to withdraw cash, but got declined!",26
253,I need another card,39
254,I didn't receive the amount of cash I requested for the ATM.,75
255,Will I get charged on a foreign currencies exchange?,31
256,"I need my PIN, where is it?",38
257,"I would like some more physical cards, what is my limit?",39
258,How do I go about getting hold of a virtual card?,40
259,Where do I access the auto top-up function?,4
260,How do I reactivate a card I thought I lost?,13
261,Is my card accepted anywhere?,10
262,"Pending still shows on this transfer, why?",48
263,"The ATM would not give me cash,why?",26
264,Why did I only receive this much currency?,76
265,How long should I wait for the card to arrive?,12
266,How long does it take for a top up to go through,47
267,is there a frequent currency discount?,31
268,"I notice a transaction a couple of weeks ago in my account, from a seller that I don't recognize. Is there a way we can trace back the information to make sure it was truly something I did?",28
269,Do I get charged for a top up from a European bank?,57
270,When will my pending payment finish?,45
271,Do I have to go to an actual bank to change my PIN?,21
272,Account topping up bank transfers to my account assistance please?,65
273,How to access my virtual card,40
274,Why is top up not working if I use my American express with my apple pay?,2
275,The balance does not appear to have updated.,5
276,"There is a pending payment on my account, what does this mean?",45
277,How do I obtain a second card?,39
278,I can't withdraw any money from my account. Ive tried a couple different ATM machines and both of them wouldn't give me my money. What's going on? Is my account frozen or something?,26
279,How long will it take for my transfer to arrive?,66
280,"My payment was put back, I think.",53
281,"please help me with this transfer, for some reason i can't transfer to a cryptocurency account",27
282,How soon will my balance be updated to reflect my transfer?,5
283,There was an extra fee when I was at the ATM.  Why?,19
284,"Why are you charging for cash withdrawals? I went to withdraw some money earlier today after getting my groceries, and it appears there is a fee that wasn't there before",19
285,Where's my card PIN?,38
286,When will the money reach my  account?,67
287,"I seem to have a problem here, I bought something about a 2 weeks ago and just now received the payment back into my account and I've already received the item. Can you tell me what is going on here?",53
288,How do I get my card on the app?,13
289,I want to know about your refund policy.,52
290,can you express my card to me?,12
291,Help!  The app says I took out cash but I didn't!,20
292,"Can you please assist me in Apple Pay, in getting Top Up to work?",2
293,"I thought I left my card at a restaurant, but they claim not to have it and now I don't have any idea where it is. I'm so worried that someone might be using it fraudulently. Is there any way to look into this?",41
294,Tell me why there is a fee for a card payment.,15
295,I did not get enough cash,75
296,Will you be able to exchange to EUR?,36
297,Can you tell me what the exchange fee is?,31
298,What documents are required for proof of identity?,69
299,"Someone is making transactions on my account, I think they took my card information.",22
300,What type of fiat currencies do you support?,36
301,I just bought an item and would like to stop payment can you tell me if the item has been sent yet?,52
302,"Hi, I have been transferring money to my friends since morning, but all my transactions were getting failed. Can you please look into this issue.",35
303,Is there a maximum for top-ups?,60
304,Can I use a credit card from the US to top up?,54
305,Tell me why there is a charge on my cash withdrawl.,19
306,My payment has been returned.,53
307,What currencies and methods can i use to top up my account?,54
308,I already have an account. Why can't I use it unless my identity is verified?,74
309,I made a mistake this morning when I did a transfer. How do I reverse it?,8
310,Why are fees charged for cash withdrawals? I went to withdraw some money earlier today after shopping. There's a new fee that there.,19
311,Why was I charged twice for the same thing?,63
312,Was my card payment reverted?,53
313,Can you deliver the PIN separately?,38
314,How's the exchange rate?,32
315,Can we skip verifying?,74
316,My card is showing the same transaction over and over again.,63
317,"Hello I made a bank account transfer from the UK. The transfer was a couple hours ago, nothing has shown up yet.  Can you check to see if everything okay. Please.",5
318,Is this card accepted by ATMs?,3
319,I have a missing refund,51
320,Can you activate my card pls,0
321,What are the disposable cards restrictions?,29
322,I bought an item then noticed the exchange rate was wrong.,17
323,I made a payment but the app cancelled it.,53
324,How many currencies can I have money in in my account?,36
325,The ATM keeps rejecting my Payment. I tried two different ATMs but did not work .Can you please check if everything is okay with my account?,26
326,I've deposited a check in my account but the cash isn't showing as available.,6
327,Someone took my card without my permission.,41
328,"I topped up last night but don't have any funds, why not?",47
329,How can I verify the top-up card?,71
330,What kind of security protects my money?,70
331,How long until transfers complete?,48
332,There are fraudulent charges that I didn't make on my card. Can you please put in the safeguards necessary to stop this from happening anymore?,22
333,My address is incorrect on my file.,30
334,where can i located the auto top up function?,4
335,Why would my transfer be declined?,27
336,The exchange rate was not correct for the item I bought.,17
337,I couldn't make a transfer because it was declined,27
338,Where in the app do I go to make my new card show up?,13
339,I am out of money in my account and I was wondering if I could do a bank transfer is put more in it?,65
340,When will my payment go through?,45
341,I would love one of the virtual cards!,40
342,What to do if my card has been used without my permission?,22
343,"I enetered the wrong information, I need my account unblocked How do I do that?",49
344,Someone else made a Direct Debit transaction on my account,28
345,I am unable to transfer money. I believe it is not working because it states it was declined.,27
346,Can I use Apple Pay to top-up?,2
347,"My card was declined and I did not receive money from the ATM earlier, yet it show on my account that it is pending.",46
348,My card payment has been stuck on pending. What is the problem? It should have gone through by now.,45
349,My morning transaction needs to be canceled.,8
350,Where's the money from my transfer from Europe?,67
351,How does on apply fora refund on an item he ordered? I ordere an item and have not received it yet so i want to cancel it and get a refund,52
352,"My card is stuck inside the ATM, what am I supposed to do?",18
353,"I want to top up by transfering accounts, What do I do?",65
354,"Hello, I just checked my card transactions and saw that I was charged twice for a restaurant visit I did earlier this week. Is it possible to remove one of them and get my false paid money pack?",63
355,My payment did not go through because the app reverted it,53
356,why was i charged a fee to transfer,64
357,Why wasn't my bank balance updated?,5
358,Is there an extra fee to exchange currencies?,31
359,"I completed a transfer within the UK two days ago, but it is still not showing received.  I have verified the account number is correct already.  Is there anything else I need to do or is there a problem?",66
360,My money didnt go through after I transferred.,7
361,How do I top up using my card?,62
362,why hasn't a transaction to a friend cleared yet?,66
363,Am I able to get a refund for a purchase?,52
364,Am I charged more for using the ATM?,19
365,Is it possible to get a second card for my daughter?,39
366,Why is my cash withdrawal still showing as pending?,46
367,Can I still use my account without verifying my identity?,74
368,My friend says he hasn't received my transaction,66
369,I need help right now. I realize I sent my payment to the wrong account number after making a typo. Please cancel the transfer now since I can't do it from the app.,8
370,My card didn't go through.  It doesn't make sense.  You told me that everything was ok.,25
371,cancel my account,55
