,text,label
6450,"You will hear back from us about your verification results in 10 minutes to a one hour timeframe.  If these verification results do fail, please double-check to make sure your images are clear and have no glare or blur; your photos need to be fully readable.  You need to be 18 years of age or older and a resident of Switzerland or the European Economic Area to create an account.",68
6451,Why was I charged an extra fee from the ATM?,19
6452,Why haven't I gotten my payment yet?,45
6453,Why isn't my google pay top up working?,2
6454,Do you know why my card payment has been declined?,25
6455,"Hi, I have done a topup, but my money was reverted. Please look into this issue.",61
6456,How much does it cost to make transfers?,56
6457,There is a  €1 fee on my account I didn't authorize,34
6458,Could I raise a dispute for a large payment that i found out was not done by me in my couple of last statements? I am aware its delayed now. Please help me out.,28
6459,My card stopped working after multiple transactions. Why?,14
6460,Can you tell me how to top up on my card?,62
6461,I don't think I should have been charged a fee to use my card.,15
6462,Can I transfer my paycheck to the account?,50
6463,"I'm supposed to be getting a refund but it hasn't shown up, now what?",51
6464,What is the process for activating my new card?,0
6465,The machine only paid me a hundred when I wanted 20,75
6466,"Hey, I ordered a thing but changed my mind and want a refund on it. Since I haven't received the thing, would you just go ahead and cancel the payment for me?",52
6467,My salary is deposited in GBP. Do I need to choose the currency?,50
6468,Why is this fee being charged to me after using my card?,15
6469,Can you help me transfer money into my friend's bank account? I tried to do it but it keeps rejecting me. I need to get the money in there asap. I have enough and all the account info is correct.,35
6470,How can I make my card show up in the app?,13
6471,Can you tell me the status of my new card?,41
6472,why is a transfer to beneficiary not possible?,7
6473,am i able to receive my salary this way?,50
6474,Where do I go to get my new card linked?,13
6475,"Give me back my money, I'm not paying the sellers. It has been a long time ago that I made an order and it just isn't coming.",52
6476,How can I move money from my account at a different bank to the account I have at this bank.,65
6477,Can you help me get Top Up to work in the Apple Pay function?,2
6478,Would I be able to get a second card?,39
6479,I need to update my demographics.,30
6480,Can I activate my card?,0
6481,There were a couple of payments that I have noticed on my account with my card that I didn't make. Is it possible that somebody else has my card information?,16
6482,Can I open an account for my children?,1
6483,I noticed a new fee on my account. I didn't know there were fees for these payments. What is the policy?,15
6484,I want to make an online purchase but I don't want to use my credit card. Can you tell me how a disposable virtual card works and where I can apply for one?,37
6485,"A 500 pound cash withdrawal was just made from my account, but I didn't make it. I am pretty sure my card has been compromised - can you help me?",20
6486,How do I get Top Up to work in Apple Pay?,2
6487,What is the refund procedure?,52
6488,"My transfer was declined, why is that?",27
6489,How can I receive my salary in another currency?,50
6490,Do you support changing the currency I use?,33
6491,after going over my transactions for the last couple of months I noticed a pretty large charge that I know I did not make. I know it's been a while but can I still dispute this charge?,28
6492,I don't recognize the direct debit payment on my account.,28
6493,What can you tell me about the card PIN?,38
6494,"I traded some of my money from my native country into an ATM to exchange for foreign currency, and the money I received was a different equating amount!",76
6495,I bough an item and the exchange rate was incorrect.,17
6496,"I need to add more funds to my card today because it keeps being declined, and I need to use it immediately. Can you fix this or tell me alternatives?",59
6497,I noticed my card was used in a small town that I have never been to. Can you stop the card from being used more?,22
6498,How many days does it take for a transfer to go through?,67
6499,"Hi, I am disappointed to see such a bad exchange rate and hope you can assist me. Would you be able to confirm the official interbank exchange rate for me?",17
6500,Where do you export the cards to?,43
6501,Why is the cash not showing in my account for the check I deposited?,6
6502,I wanna revert a transaction i did this morning.,8
6503,Why am I unable to withdraw money even though in the past I've done it just fine?,26
6504,Why did I get charged for a transfer?,64
6505,Do I have to manually top-up my account each time or will it do it on its own?,4
6506,I have to make several disposable cards per day.,29
6507,Are there any charges for European bank card for top up?,57
6508,I have a disposable card but it does not work?,72
6509,Why is my identity verification process not working?,68
6510,I would like to change my personal details.,30
6511,Am I able to add money into my account using my American Express?,54
6512,"So, my transfer is showing as pending, when will it actually go through?",48
6513,The exchange rate you are using is bad.This can't be the official interbank exchange rate.,17
6514,why didnt my account allow a transfer,7
6515,I want my purchases cancelled.,52
6516,"I have a cash withdrawal that says it's pending, why?",46
6517,How are foreign exchange rates determined?,32
6518,How much is it to use my US debit or credit card to top up?,57
6519,What do I do if I have been charged twice?,63
6520,What does it mean if my payment was reverted?,53
6521,Can I have a refund for one of your products?,52
6522,"Hello, is there any way to double check my card? I have never had issues with withdraws in the past, but this morning on the way to work it was unexpectedly declined.",26
6523,What currencies are approved to add money?,54
6524,Where can I locate my PIN at?,38
6525,"Is there a fee for making a payment? If so, let me know why.",15
6526,How can I order my card?,43
6527,What am I being charged an extra pound when I haven't bought something worth that much?,34
6528,"A transaction I did to my friend hasn't arrived yet, why?",66
6529,"Help, your app is showing a larger WD than I actually did earlier at an ATM.",75
6530,I'm interested in what your exchange rates are based on.,32
6531,Why was my card charged when topping off my balance but it's not showing up in my wallet balance?,62
6532,Am I gonna be charged for sending out more cards?,39
6533,Google pay top up not working.,2
6534,Is there anything to do because my phone was stolen?,42
6535,My credit card was declined for top-up. Can you see if there is enough funds in my account?,59
6536,How long is a delivery to the US?,12
6537,Please help me as my online payment is getting declined since yesterday while i am trying to purchase something online.,27
6538,What happened to my cash deposit?,6
6539,I'm having problems with ID verification,68
6540,Would I be able to refund an item?,52
6541,How can I go about getting a refund?,52
6542,My top up card needs verification and I don't know how to do it,71
6543,I was charged an incorrect exchange rate for a withdrawal.,76
6544,Can you accept my other card from the U.S.?  It is the only other one I have.,54
6545,I believe my card has been compromised because of a strange withdrawal,20
6546,Why have my top ups been canceled?,61
6547,Is there a way to use a cheque to top up my account?,58
6548,How can I open an account for my children?,1
6549,Why was I charged for transferring money?,64
6550,I cant prove who I am,68
6551,What do I do if my phone was stolen?,42
6552,How long does it typically take to make a transfer from a UK bank? I just made one and it hasn't shown up in my account yet.,5
6553,I just have one additional card from the USA. Do you support that?,54
6554,I don't see a code anywhere on my top-up card? Where can I find it? I need to verify!,71
6555,details need to be modified,30
6556,Is the EUR accepted for exchanges?,36
6557,Help! My card isn't working at the ATM and I know I used the right PIN. Trying to get my money.,26
6558,How can I obtain a disposable virtual card?,37
6559,How long will it take the money to appear in my account?,67
6560,My card is lost!  Please help me!,41
6561,I just initiated a transfer but I'd like to cancel it.,8
6562,Where did my deposit for my source of funds come from?,70
6563,Where do you mail physical cards?,43
6564,Why did my card payment get declined?,25
6565,What does it mean if my payment has been reverted?,53
6566,i have a pending top-up,47
6567,How do I go forth with bank transfers for top up accounts?,65
6568,There is a payment that I made that hasn't gone through yet.,45
6569,Why didn't my transfer get to the recipient?,66
6570,Can you tell me the restrictions for the disposable cards?,29
6571,The exchange rate is incorrect for my cash withdrawal transaction.,76
6572,"After I deposited my cash, I still don't see it in my account.",6
6573,What different currencies can I get?,33
6574,If I am running low on credit can I auto top up?,4
6575,Can I make a contactless payments?,23
6576,The exchange rate on my payment doesn't look right,17
6577,Can I possibly change my currency to another?,33
6578,I believe that my card has been stolen!,41
6579,Why is the transaction to my friend still pending?,66
6580,Can I set my own top-up limit?,60
6581,I wish to be able to top up with cash.,58
6582,Can you tell me why the card payment came back?,53
6583,What should I do if I can't use my card?,14
6584,Where are you present globally?,24
6585,The amount of cash i have received is not correct.,75
6586,I was wondering if international transfers take longer than normal because I made a transfer from France a couple of days ago and nothing has happened yet?,5
6587,I would like to dispute a direct debit transaction,28
6588,There is a direct debit set up that was not authorized by me.,28
6589,explain the interbank exchange rate,32
6590,I'm not sure if my pop-up went through.,59
6591,My phone was left behind.  Can I still use my card?,42
6592,I keep being asked to verify my identity. Is this normal?,74
6593,I need someone to assist me with explaining how much I can top-up.,60
6594,Why do I need to verify the top-up?,71
6595,Why am I unable to transfer money when I was able to before?,7
6596,I've just got married and want to change my name.,30
6597,What are the currency exchange fees?,31
6598,Can I open an account for my offspring?,1
6599,I shouldn't be charged any fee for transferring .,64
6600,My card gets rejected when I try to use it,14
6601,Tell me why my transfer is pending.,48
6602,card is being used by someone else,22
6603,I should have a refund in my statement but I can't see it,51
6604,I believe my card payment were reverted,53
6605,How do I replace my card before it expires?,9
6606,My refund is still pending,51
6607,I don't know my password,44
6608,i need to proof my identity to you why and how?,74
6609,What was the extra charge for using my card?,15
6610,"Hey I want to get a refund on something I bought, but not sure how to go about it. Can you please just cancel the payment, I have not received the item yet.",52
6611,What do I do?  The ATM took my card!,18
6612,what do i need to have with me to activate card,0
6613,What's the exchange fee?,31
6614,Can I change my name?  I am not married.,30
6615,"If I bought something I didn't like, can I get a refund?",52
6616,Do I have to pick a creditcard brand?,73
6617,I have a duplicate charge,63
6618,Do you offer auto top ups?,4
6619,My new card came in.  How do I activate?,0
6620,When should I expect to receive my card?,12
6621,The app does not know it is me.,68
6622,Tell me how I can verify a card top-up.,71
6623,"I heard that you support more than one type of fiat currency, would you tell me which ones please?",36
6624,Is it possible for me to track the card is was mailed to me?,11
6625,"I have a disposable card, how many transactions can I make?",29
6626,What countries do you operate in?,24
6627,Where is the option to top up with a cheque?,58
6628,When I made a cash transfer abroad the wrong exchange rate was applied,76
6629,Where do I go to update details?,30
6630,What works for identity verification?,69
6631,I have been charged twice for the same transaction.,63
6632,I think the bank made a mistake on the exchange rates,76
6633,Can it add money every so often automatically while I travel?,4
6634,I need to close my account.  Your company is terrible!,55
6635,why wont my american express work to add money,54
6636,I must have entered my PIN wrong.,49
6637,I don't have my card after 1 week. What are my next steps?,11
6638,"I haven't received my virtual card yet, do yo know why?",40
6639,What are the charges for topping up US card?,57
6640,My account did not allow the transfer.,7
6641,are there any exchange fees,31
6642,How do I change my account details?,30
6643,I forgot my passcode. Now what?,44
6644,Top up not available in my wallet.,62
6645,"When I got cash, my exchange rate was off.",76
6646,What countries can I use my account in?,24
6647,Salary in GBP has been received. Does it need to be configured into another place?,50
6648,I did not get the cash that is showing up in my app.,20
6649,I want to return an item for a refund can I do that?,52
6650,An overseas cash transfer did not work correctly,76
6651,My account balance has not updated since I deposited a cheque recently.,6
6652,I forgot my PIN number.,49
6653,Can I use my account without verifying identity?,74
6654,I do not understand why my pass-code is not working.,44
6655,How long does it take for money to transfer?  I sent some to a friend and it hasn't gone through yet.,66
6656,My preference is Mastercard.,73
6657,do you have a fee for receiving a SEPA transfer?,56
6658,What's the time frame on EU transfers? I purchased something a couple of days ago but the seller hasn't received my payment.,48
6659,Can I track my card while it is in the process of delivery?,11
6660,Why is my card payment cancelled?,53
6661,How can I tell if my card payment is reverted?,53
6662,Is there a reason for my top up to be cancelled?,61
6663,What's the maximum amount I can top up my card with please?,60
6664,Why do I see a fee when I do a transfer?,64
6665,Have have a small charge on my account from someone I purchased with but I'm not sure what it relates to.,34
6666,"If I exchange currencies frequently, is there a discount?",31
6667,Is it possible to exchange USD and GBP on the app?,33
6668,Are extra charges added for sending out additional cards?,39
6669,"I want a disposable virtual card, how do I do that?",37
6670,Is there a fee for physical cards?,43
6671,I was under the impression I can make transfers for free. I made an online purchase for something that was obroad and there's some additional strange fee. I've never seen this before and this isn't fair.,64
6672,There is a withdrawal on my account I didn't make.,20
6673,I want to find out what happened to my new card?,11
6674,Why would I be charged an extra fee while doing a transfer?,64
6675,I have been overcharged.,63
6676,How long do I need to wait til my top up isn't pending?,47
6677,The ATM didnt let me get cash,26
6678,What's the process for terminating an account?,55
6679,"I think something went wrong, I didn't get the right amount.",75
6680,Is a physical card also available,43
6681,Can I use this app for both USD and GBP?,33
6682,Is it possible to link a new card?,13
6683,What types of cards and money do you accept?,54
6684,I got cash and the exchange rate should have been different than it ended up being.,76
6685,The ATM took my card.,18
6686,Why do some of my payments have fees?  I don't understand.,15
6687,Can I get a Visa instead of a MasterCard?,73
6688,What is the minimum age limit?,1
6689,I have been charged an extra fee when buying from your store. Why is this?,15
6690,Is there a charge for a physical card?,43
6691,Why did I get charged extra?,15
6692,Can I change my PIN in Austria?,21
6693,I refilled my account balance but got an error message.,61
6694,"I locked myself out of my account, how do I unblock my PIN?",49
6695,My app statement shows I took out cash from an ATM but I did not. What can I do?,20
6696,How do I edit my details?,30
6697,"Its been 3 days, How long will my transfer take to get to my wallet?",67
6698,Can I receive money in a different countries money?,50
6699,I think my card is broke?,14
6700,I can't get my actual card to work,14
6701,Why isn't the transfer to my account showing up?,5
6702,"Hi, I checked my transactions and saw that I was charged twice during a restaurant visit. I would like to get my money back.",63
6703,I have a transaction and would like to know if I it's cancelable?,8
6704,Is my top up not working?,47
6705,The ATM shows a withdraw of the amount of money I requested but I didn't revieve that amount in cash.,75
6706,How do I input a new address?,30
6707,Is there extra fees for making a withdraw in a different country at a cash machine.,76
6708,My refund isn't showing up on my statement.,51
6709,"It seems my card payment was completed twice. I paid at the store previously and the first one did not seem to go through. After a second attempt, it did go through. I now see within the app that I have been charged twice with one of them pending. Can you please remove the pending amount because it is clearly something that was declined?",63
6710,"The expiration of my card is near, how do I order a new card?",9
6711,I believe I got a wrong exchange rate when I got cash.,76
6712,Why do you keep declining my transfers? it's always been working really well so far but when I tried to buy something just now the card got declined . I tried couple of times already  but same thing is happening .,27
6713,I need my card frozen cause it was used without my consent to take money out. It was in an odd place.,20
6714,What documents do I need to validate my identity?,69
6715,What do I do if I see a cash withdrawal on my account that I don't remember making?,20
6716,"I have one of your cards, but I don't know how to link it.",13
6717,How long will it take to deliver to the US?,12
6718,My top-up is still pending,47
6719,"I just got my new card, how do I activate it?",0
6720,why has a cash withdrawal charged me?,19
6721,It appears my top-up has not gone through.,47
6722,Is it possible to delete the account?,55
6723,Can you help me to quickly cancel a transaction I accidentally did to the wrong account?,8
6724,How old do you need to be to use the banks services?,1
6725,I keep checking my statements but nothing shows up! I requested a refund a long time ago but seems it's not reaching my account for some reason. Can you please help me get the money back from the seller for me,51
6726,What kind of cards are supported?  What currency?,54
6727,Can you lookup my password?,44
6728,Is there a fee for topping up a card?,57
6729,Why did I get a fee from the ATM?,19
6730,I noticed that the exchange rate applied to a recent purchase I made abroad was incorrect.,17
6731,The wrong exchange rate was used for my cash withdrawal,76
6732,Is the verification number on the top up card,71
6733,What are eligible holding and exchange currencies?,36
6734,What currencies can my account be in?,36
6735,Please delete the duplicate payment that was made to my account. One payment is still pending and I do not want to pay twice.,63
6736,Can I get a Visa or does it have to be something else.,73
6737,What ATMs can I use this card at?,3
6738,Do the disposable cards have any restrictions on them?,29
6739,Where are cards available to order?,43
6740,Can I transfer my salary if its in GBP?,50
6741,"I was abroad and needed some cash, but I think the wrong exchange rate was applied to the transaction.",76
6742,What currencies can be exchanged in the app?,33
6743,Hold old do my kids have to be to use the service?,1
6744,Will you please help me get my card back?,18
6745,"After reviewing my charges, I see I was charged a fee for a transfer I did, why?",64
6746,"Hello. I looked at my account and see that a transaction I tried to do is pending, but I did not complete that transaction. When I was at the ATM, the machine declined my card. Can you make sure that transaction does not go through because I definitely did not receive the money.",46
6747,The transfer that I was trying to complete was declined. What was the cause?,27
6748,There was a direct debit transaction I have don't think should be there.,28
6749,What countries do your services support?,24
6750,Can I use a check to get gas?,58
6751,I bought something online and it says there was a fee to transfer money. Isn't that free?,64
6752,"I have lost my card, but need to place an online order! How do I get a virtual card instantly?",40
6753,How do I verify my identity?,69
6754,My card is about to expire.  How do I order another?,9
6755,I was denied cash at an ATM,26
6756,How can I change my name because I just got married?,30
6757,I live in Germany. Is that one of the countries you are in? What other countries are you in?,24
6758,"Did you lose my money? I had added funds through top-up not long ago and I know they were in my account, but they seem to have disappeared. What happened?",61
6759,Why was I charged an additional fee when paying with card?,15
6760,I can't access my account.,44
6761,I didn't do a payment and I have it now.,16
6762,I tried using my ATM card at your Notting Hill location today.  It did not work.  Am I doing something wrong?,26
6763,I need to reset my passcode. Where do I go to do that?,44
6764,My recent transfer didn't go through - why not?,27
6765,"I am worried about the amount of my cheque, which should be credited to my account few days before. As i have already sent you the cheque.",6
6766,How long before transferred money shows up?,5
6767,I had transferred some money but the balance hasn't changed.,5
6768,Please help me cancel a transaction.,8
6769,I need to know the process to transfer money into my account.,65
6770,"Hi, I draw out some money from the ATM today. The ATM has given me wrong amount and the application is displaying more amount than i withdraw.",75
6771,What's wrong with my card? The clerk at the grocery store said it was declined.,14
6772,Someone stole my card!,41
6773,Some cash has been withdrawn but I didn't do it.,20
6774,I got a cheque that I want to top up with?,58
6775,Is there a limit to the number of disposable cards I can have?,29
6776,How many active cards can I have?,39
6777,Am I able to use Apple Pay?,2
6778,How long does it take transfers from Europe to complete?,67
6779,My withdrawal from the ATM was cancelled.,26
6780,Is it right that I've been charged for transferring money?,64
6781,A direct debit payment that I didn't authorise shows up in my app.,28
6782,How do I stop fraud to my card?,22
6783,Whats the maximum disposable virtual cards?,29
6784,"Apple pay is not accepting my American Express card, can you assist me with this problem?",2
6785,The ATM machine would not give my card back,18
6786,Where can I find my card PIN?,38
6787,Can you tell me why the transfer isn't showing up on my account?,5
6788,My money transaction hasn't arrived.,66
6789,What is the fee for a foreign currency exchange?,31
6790,I want to top up my account. What payment methods are supported?,54
6791,Are there limits with top-up?,60
6792,I would like to exchange currency  What types are there?,33
6793,"my balance has not changed, despite depositing a cheque",6
6794,Is it possible to top up using a cheque?,58
6795,I have gone through my statements and noticed there is a large payment that I did not make. Can i still dispute the payment? its been a while,28
6796,I haven't received my virtual card.,40
6797,Extra charge during transfer,64
6798,How long should I wait for top up go go through ?,47
6799,Why has my account balance not changed after depositing a cheque?,6
6800,Please let me know what currency I can use to top up my account?,54
6801,I would like to edit my personal information .,30
6802,"I made a big purchase that I regretted and cancelled, the merchant said that my refund was submitted. Can you confirm to me that all of my money was truly returned to me?",51
6803,What does a pending cash withdrawal mean?,46
6804,my refund has not hit my account yet,51
6805,My top-up appears to be pending.,47
6806,"I got a new card, how do I link it?",13
6807,Which fiat currencies can I use through this app?,36
6808,what is the limit for top-ups?,60
6809,What does it mean when a payment is pending?,45
6810,Where can I find the verification code for the card top-up?,71
6811,Where do I get a disposable virtual card?,37
6812,"I am having issues using contactless payments, could my card be damaged?",23
6813,Can you tell me if there are limits to disposable virtual cards?,29
6814,Somebody used my card without my knowledge!,22
6815,The cash abroad exchange rate is applied wrong.,76
6816,"My husband and I went out for our weekly ""dinner and a movie,"" and it was my turn to pick up the check. Now I see that my card was charged twice. Who should I contact about negating the second charge and getting my card credited?",63
6817,How low does the balance have to be before the system updates?,4
6818,I am very dissatisfied with the services that you are providing.  I want to cancel my account.,55
6819,I need my payment in another currency,50
6820,My card payment won't work.,25
6821,Do I need to do something to get a new card once it expires?,9
6822,I need to cancel a transfer I made.,8
6823,is it possible to get a refund for something I purchased?,52
6824,My transfer hasn't appeared yet,48
6825,How do I find the code needed in order to verify my top-up card?,71
