,text,label
4542,"When I withdrew my money, why was there an extra charge?",19
4543,Was there a number to track that I could get?,11
4544,How much does it cost to exchange my balance into a foreign currency?,31
4545,Is there a charge for getting more cards?,39
4546,What do I do if my card is about to expire?,9
4547,I believe that someone is using my card without my knowledge!,22
4548,Why am I charged whenever I withdraw cash?,19
4549,I made a cash deposit going to my account but it is not there,6
4550,Is there a Mastercard ATM nearby?,3
4551,Can you tell me what this cash withdrawal is?,20
4552,The ATM didn't give me the amount I asked for,75
4553,"I recently reported my card as missing/lost, and I just found it. Can I still use it?",13
4554,Tell me where I can find the auto top up feature and a little bit about it please.,4
4555,Does it cost to add money to my card?,57
4556,What's my limit for topping up?,60
4557,"I need a card reactivation, I had reported my card lost but I ran across it in my jacket.",13
4558,Are there steps I need to take before my card expires?,9
4559,where can i see money source?,70
4560,"I went to the store and tried to make a purchase.  The first time, it was declined, but the second one went through.  But my App shows me that I've already been charged once and the second charge is still pending.  Can you make sure that I'm not charged twice?",63
4561,Please explain the fee on a transfer I made.,64
4562,I got some cash but it wasn't the right amount.,75
4563,Can you explain to me why a top-up would still be pending?,47
4564,I don't have my cell phone with me so I cannot access the system to complete the transaction.,42
4565,What value can I get for my currency?,32
4566,Can I be charged for exchanging foreign currency?,31
4567,I haven't yet received money that I transferred,5
4568,Are there limitations to what currency I can hold?,36
4569,Is there a limit on the number of times I can use a disposable card?,29
4570,Where can I order a card?,43
4571,The disposable cards - what are they for?,37
4572,I am travelling and I was wondering what your exchange rates are,32
4573,I have left my card at my parents house. Can you send me a spare one please to use in the meantime?,39
4574,There is an unauthorized payment in my statement.,16
4575,"Help!  I fear that my card was stolen,",41
4576,The ATM did not give me my card back?,18
4577,"Hello, what is a virtual card and how do I get one?",40
4578,Can you please explain to me why there is an extra €1 fee in my statement?,34
4579,I want to deposit my check to top up my account,58
4580,"How much time do transfers take? I sent money to a friend who needs it fast. It's been hours, and the money has not gone through.",66
4581,My package is taking too long to arrive and I don't want it anymore. Can I get a refund?,52
4582,My card is missing!  Help!,41
4583,Can I tell if my top off didn't work?  It doesn't seem to have.,59
4584,Can you walk me through how I can edit some of my personal information?,30
4585,"I had a cheque deposited, but I don't see my money yet?",6
4586,How do I perform identity checks?,69
4587,Why do I still have a pending cash withdrawal?,46
4588,I found my card again. Can I put it back into the app?,13
4589,There was a direct debit from my account and I didn't authorise it,28
4590,"I've tried to send money to my friends and I keep getting rejected. Can you please tell me why, I don't understand.",35
4591,I want my card frozen right away. Money was taken out in an odd location I have never heard of.,20
4592,How do I find the top-up verification code?,71
4593,"I haven't received my transfer funds yet, where are they?",48
4594,can i order cards on the app,43
4595,"I no longer have my phone with the app, what should I do?",42
4596,Can I auto top if I'm low on funds?,4
4597,There's a direct debit payment that I don't recognize.,28
4598,I see a direct debit charge that I did not approve,28
4599,"I just saw some charges on my card from the past days that I dont recognize, I need to freeze the card asap! Will I be able to get my money back?",16
4600,I placed a cash deposit in my account but I can't see it yet.,6
4601,I tried to get funds in hard cash but it was rejected!,26
4602,I ordered my card a couple weeks ago and haven't received it yet. When can I expect it?,12
4603,What is the fee on my statement for?,34
4604,Why is the payment on my card still pending?,45
4605,A duplicated payment was made for something.,63
4606,What is the fee for a cash withdrawal?,19
4607,The exchange rate that was applied for an international purchase was wrong.,17
4608,I'm in China and need a new card. Please help.,9
4609,Are there top up charges for US cards?,57
4610,My new card isn't here and it was issued a week ago.,11
4611,I'd like to use my American Express to place money into my account.,54
4612,I have a fee and I don't know why,15
4613,I am unsuccessfully trying to make a transfer can you help?,35
4614,I took out money from the ATM and it's still showing as pending?,46
4615,"My card info was stolen, what do I do?",22
4616,I think I was charged extra on my payment on last Saturday.  Maybe the exchange rate was wrong?  I'd like a refund.,17
4617,It is urgency. Please freeze my card now. As someone in some odd remote town has withdrawn some money by using my card. As i did not withdraw any money.,20
4618,"I tried to withdraw cash and got declined, why is that?",26
4619,Who can send me money?,50
4620,Can I edit my personal details?,30
4621,I am unaware of what my password is.,44
4622,I need to find out where the card is that I ordered.,11
4623,I am still waiting for a refund,51
4624,How do I make my PIN work again?,49
4625,Can I add money automatically to my account while traveling?,4
4626,Help! In the app there is a payment that I don't remember.,16
4627,How much does it cost to top up a US-issued card?,57
4628,Is American Express supported for adding funds?,54
4629,Why wasn't my payment to beneficiary X approved?,7
4630,Tell me your opinion on the exchange rate.,32
4631,What do you charge for an exchange fee?,31
4632,"Hi, My card is getting declined continuously when i am trying to top-up. Request you to look into this issue or tell me any other alternatives.",59
4633,What does it mean when it says I have a payment pending?,45
4634,Where is the top-up verification code sent?,71
4635,how do i dispute a payment I didnt make,16
4636,There is a direct debit charge on my account that I don't recognize.,28
4637,How can I update my personal information after moving?,30
4638,Can I reset the passcode?,44
4639,How long will it be to get this new card?,11
4640,Please help me!  My physical card isn't working right.,14
4641,I need to close my account as soon as possible.,55
4642,ATM is broken. It did not give me the full amount (30 pounds.)  I'm standing here with only 10 pounds and it's telling me it gave me 30 pounds. I need assistance now!,75
4643,I want to use a cheque to pay.,58
4644,I believe my top up has failed,59
4645,What is the time frame that it usually takes for a transfer to come through? I have a friend needing it immediately but it has yet to come through.,66
4646,"Hey I am standing in front of an ATM here, it only gave me 10 pounds even though I wanted to withdraw 30! Seems like the app has 30 pounds, what do I do??",75
4647,Hi I am trying to transfer money to another country but it is showing pending and it has been a long time.  I have checked numbers and they are correct.  Could you please help?,48
4648,"If I ordered my new card last week, how much longer should I wait to receive it?",11
4649,There is a payment with my card which i definitely did not make by me .Never seen that it before.,16
4650,I'm on holiday and I noticed a different amount for exchange rate.  Can you explain?,17
4651,Where is the top-up card verification code?,71
4652,Is there a charge for top-ups?,57
4653,I don't understanfd how to top up,62
4654,When my card expires what is the cost of a replacement and how fast?,9
4655,Tell my why my top-up is pending.,47
4656,I made a purchase with my card and I was charged a fee for using it,15
4657,What's the web address to unblock my pin?,49
4658,"I was charged a transfer fee, why is that?",64
4659,Can you elaborate on why I have an extra charge just for transferring?,64
4660,"Errors keep showing up every time I try to make this transfer and I am on a time crunch,  could you please help.",35
4661,Could you explain why my card payment did not work?,25
4662,Where is the top-up verification code?,71
4663,"I want a Mastercard, instead.",73
4664,Where do you deliver cards to?,43
4665,"While getting cash, I was charged a fee.",19
4666,i need help. I updated my balance with a check yesterday and Im not seeing it. Can you look at my account to see what went wrong?,6
4667,"I normally don't use ATMs, but I was in a rush today and had to withdraw some cash. The ATM gave me the wrong amount of money and now my app is not showing the same amount as it should. What do I do?",75
4668,is there a foreign currencies charge?,31
4669,How long will a transfer from the US take?,67
4670,An ATM machine didn't give me back my card.,18
4671,I tried activating my card and it doesn't work how do I solve this problem?,0
4672,Why are the things I bought earlier today still showing as pending?,45
4673,Why is it taking so long for my money to appear in my account? I have been waiting a week!,6
4674,There are a couple of payments with my card shown in the app that I really didn't make myself. Why is it happened?,16
4675,Can I create my own top-up limit?,60
4676,"My friend wants to send me money, can she?",50
4677,What happens if I forget my PIN?,49
4678,"Transfers may show up as pending for up to one business day while they are processed, and then they'll depart for the beneficiary accounts. Please confirm that you have correctly entered your account details. SEPA transfers typically take up to two working days, while SWIFT transfers can take up to five working days.",48
4679,"I recently transferred some cash, but the balance has not changed.",5
4680,What is this extra €1 fee about?,34
4681,Why is my card payment still pending?,45
4682,Are you ripping people off with the exchange rate?  It can't be that atrocious between banks.,17
4683,Are there specific ATM's that I can draw money from?,3
4684,I have a payment which has not been approved.,45
4685,How long do money transfers take? My friend really needs the money i sent a couple of hours ago but it's not there yet.,66
4686,"If I am in China, can I still order a new card and if so, how?",9
4687,Where do I go to activate my card?,0
4688,"I put in a payment a while ago and it has still not cleared and is showing up as ""pending"", how long does it take to clear?",45
4689,I got a €1 extra fee in my statement,34
4690,I think I was wrongly charged in a recent transaction when I used my card.,15
4691,how long should i wait ti activate my card,0
4692,"I can't see if the transfer I did a couple days ago is in my account yet. I double checked my info before sending, too. Can you check this?",66
4693,Can you tell me more info about virtual disposable cards?,37
4694,"I don't want this account anymore, how do I delete it?",55
4695,There is a weird payment in my statement.,16
4696,This fee shouldn't be there after I paid with a card.,15
4697,I noticed that there was an extra charge fee on my account. Could You explain to me why?,64
4698,I have a transfer that was approved that I'm urgently waiting for. How long am I supposed to wait for it?,48
4699,The top-up I ordered didn't process.,59
4700,Can you tell me how many currencies I can hold?,36
4701,What forms of payment do you accept?,54
4702,"I have a US credit card, will you accept it?",54
4703,I went tot the ATM earlier today and didn't realize this till now but I did not get all the money I requested.  I believe my account was charged for 100 but I only got 80.  Is there any way we can solve this problem?,75
4704,I didn't withdraw the amount of cash that is showing up in the app.,20
4705,I tried updating my balance by cheque yesterday but it doesn't seem to be working. Shouldn't that be faster? Please check my account something has gone wrong there.,6
4706,Why did it cost money to transfer funds?,64
4707,I cannot get my disposable virtual card to work,72
4708,how much do I have to pay for exchange of currency?,31
4709,Cash I did not get showed up in my account,20
4710,I need to transfer funds from my other bank account into this bank account.,65
4711,What do I need to do to cancel a transaction?,8
4712,I was wrongfully charged one pound.,34
4713,"I cannot remember my passcode, is there a way to retrieve it?",44
4714,Do top-up limits exist?,60
4715,How much do I need to pay for a transfer?,56
4716,Why was I unable to finish this transfer?,35
4717,How do I go about transferring money into my bank account?,65
4718,when will I get my refund?,51
4719,Explain to me how to verify the top-up card.,71
4720,Why doesn't the person I sent money to see that transfer yet?,66
4721,Are there limits to businesses that will accept this card?,10
4722,How recent do my documents need to be for verification?,69
4723,There is a payment showing that I know I didn't make. I didn't use my card that day and I'm sure of it. Can you please cancel that transaction and return my money? Thankyou,28
4724,"the product is not working, can I get a refund?",52
4725,How many transactions can I make on my disposable card?,29
4726,I haven't gotten my new card.,11
4727,I need to figure out who has access to my card there are some payments I didn't make that are showing on the app.  Could you please help?,16
4728,Is there a cash withdrawal fee? Because I just got charged?,19
4729,Can I unblock my PIN in the app?,49
4730,"I live in America, but I would like a card.",24
4731,A payment shows up on the app that I never made.,16
4732,How do I troubleshoot my contactless?,23
4733,Cash withdrawal was incorrect at ATM.,75
4734,How long do transfers take to go though,5
4735,Where can the cards be delivered?,43
4736,if im not using my account should i close it or just let it sit,55
4737,Which countries do you currently support?,24
4738,i haven't received my order and want a refund,52
4739,Why is there a fee when I thought there would be no fees?,15
4740,My refund has not shown up on my statement.,51
4741,"I want to give a second card for this account to my daughter, would this be possible?",39
4742,I purchased this item and would like a refund,52
4743,What should I do if my card payment was cancelled?,53
4744,How do I get my card back after the ATM swallowed it.,18
4745,How old do my kids need to be to use your service?,1
4746,I sent a cheque a few days ago and i noticed that no money has been put on my account. Can you please tell me the situation of my account?,6
4747,The cash I wanted wasn't there.,75
4748,need to know where money comes from,70
4749,There is a withdrawal in my account I didn't make.,20
4750,The card payment is declined.  Please inform me why.,25
4751,"Why did my transfer not work, it says it was declined?",27
4752,I don't think that my top-up worked.,59
4753,I want this fee reversed from my account.,52
4754,Can I exchange my money for EUR?,36
4755,Is it possible for friends to top up my account?,62
4756,I haven't received the money from the check I deposited.,6
4757,How much does it cost to get more cards?,39
4758,What are the steps I need to take to cancel a transaction?,8
4759,Is there any way to see my card in the app?,13
4760,if i found a lost card can i put it back in app,13
4761,I wanted to purchase something online but the payment was returned back to me. This has been going on for a couple of weeks. Please tell me what is going on here?,53
4762,Something's wrong my card won't work.,14
4763,I would like to cancel my order.,52
4764,"I have lost my phone, what steps can I take to prevent someone using my account?",42
4765,The payment I made with my card is not showing up.,53
4766,When will I get a virtual card? I haven't gotten one yet,40
4767,Are there restrictions on new cards in China?,9
4768,I am confused about your fee structure and was disappointed to see a fee for my transfer.,64
4769,I have an unusual payment in my statement,16
4770,Are there fees for adding money with an International card?,57
4771,Is there a way to track my card?,11
4772,What are the restrictions on the virtual cards?,29
4773,"I was charged extra when I made a cash withdraw, why?",19
4774,I'm not seeing my cash deposit showing up in my account.,6
4775,Is there any limits I should know about if I'm going to use a disposable virtual card?,29
4776,Tell me about the limit for top ups.,60
4777,I messed up a transfer and need to reverse it.,8
4778,Why has my transfer not arrived yet?,66
4779,where did my funds come from?,70
4780,"It says ""pending payment?"" Why is it saying this?",45
4781,Is there a fee for topping off by transfer?,56
4782,Why should I have to prove my identity?,74
4783,There's a duplicate charge on my account?,63
4784,"I transferred money to another country several days ago, but my transaction is still pending. i have checked that the accounts are keyed in correctly. what sees to be the problem?",48
4785,Please tell me how to change my pin.,21
4786,I transferred some money to my mom 2 days ago and she has not received it. I double checked the information and it looks right. Can you help me?,66
4787,"What are my options for topping up, automatic and/or manual?",4
4788,"I purchased something and already received it, why hasn't the money taken out?",53
4789,Can I exchange currency to Europe?,36
4790,Can you tell me where to find my top-up verification code?,71
4791,I'm wondering how long it takes for my money to get to me after a bank transfer.,5
4792,How long do I wait for my PIN,38
4793,Can I top-up by cheque?,58
4794,Can I use a different bank ATM than my own?,3
4795,I need to cancel my card.  There are a few charges from a couple days ago that I didn't make.  Can I get credit for these charges?,16
4796,Why isn't my balance reflecting a transfer I did?,5
4797,I did not get the right exchange rate while getting my cash out.,76
4798,My card payment did not go through.,25
4799,Who do I make a check out to if I want to top off my account?,58
4800,Is there a reason behind why my transfer did not work?,35
4801,I would like to cancel my previous transaction,8
4802,Someone stole my wallet a couple of hours ago now and they have taken money from my account. Is there any way that you can help so I won't lose any more of my money.,20
4803,This exchange rate you use is awful! Please tell me this is a mistake and not the official interbank exchange rate!,17
4804,Why is my transfer not showing,5
4805,My card hasn't arrived in the mail yet. I ordered it two weeks ago. What can I do?,11
4806,What is the first step that I should take after my card has been stolen?,41
4807,How can I lookup the source for my available money?,70
4808,Why was my card payment reversed?,53
4809,"May monthly payment to Apple has been declined but I don't know why, they are going to re-try the payment and it must go through, can you tell me what is going on please?",25
4810,What currences are available for exchange?,33
4811,"My marital status has change, I got to correct my name to reflect that.",30
4812,Do you have info about the card on delivery?,11
4813,"My PIN is unlocked, what do I do?",49
4814,What should I do if I have used all of my PIN tries?,49
4815,I made a payment that's pending. Will it go through?,45
4816,I need several disposable cards made per day.,29
4817,I see cash in my app but I did not get it.,20
4818,What are my payment options for topping off my account?,58
4819,"I ordered something, and now I have buyer's remorse. Since what I ordered hasn't come yet, can you just cancel the payment since I already know I want a refund for it?",52
4820,I added money but my top-up wasn't processed by the app.,59
4821,I topped up and now my money is not there anymore! What happened to it?,61
4822,I topped up my account but the money isn't there now.,62
4823,I made a payment but it's still pending,45
4824,The app is showing a payment I never made.,16
4825,What fees are charged when I top up,57
4826,I had the wrong exchange rate applied to some cash I got abroad.,76
4827,What if I don't verify my identity?,74
4828,How long until I see a cash withdrawal?,46
4829,Where can I sign up for a virtual card?,40
4830,Which currencies do you handle?,54
4831,My refund isn't showing up,51
4832,Why hasn't my ID been verified?,68
4833,How can I fill up my gas tank using a check?,58
4834,"I just got a card, how can I add it to the app?",13
4835,I submitted a transaction but it was for the incorrect account.,8
4836,How fast can I transfer something from China?,67
4837,Can I pick between Visa and Mastercard?,73
4838,Someone else used my card to withdraw cash from an ATM,20
4839,Is there an additional cost to exchange currencies?,31
4840,Why can't I withdraw money?,26
4841,I don't understand why my card payment is pending.  It has been pending for too long.  Why is this and when might it go through?,45
4842,"Last Saturday, I made a payment and the exchange rate was wrong.  I was charged too much.",17
4843,why do i have a failed transfer,35
4844,How long is the wait for my card?,12
4845,I cannot see the card PIN anywhere?,38
4846,how much will I be charged for making a transfer?,56
4847,Is it possible to obtain both a Visa and a Mastercard from you?,73
4848,My identity can't be verified for some reason,68
4849,Where's the money I transferred into my account?,5
4850,If I exchange currencies on a frequent basis can I receive a discount?,31
4851,How come I was charged a transaction of $1?,34
4852,I have a duplicate payment on my account,63
4853,Could you tell me about the restrictions that are on the disposable cards?,29
4854,My card got stuck in an ATM.,18
4855,Why is the ATM not allowing me to get cash?,26
4856,Why was the exchange rate so wrong when I bought something!,17
4857,What do I do if my card expires soon?,9
4858,Where is the cash I deposited?,6
4859,Can I deposit money using Apple Pay?,2
4860,How do you do currency exchanges?,32
4861,The app doesn't think it's me.,68
4862,It seems that something went wrong with my exchange. I changed Russian Ruble into UK pounds but have been charged entirely too much!,17
4863,lost my card in atm,18
4864,What are the fees imposed when I make a transaction?,15
4865,Is it possible to get both Visa and Mastercard from you?,73
4866,I can't find my card!  What should I do?,41
4867,How can I set up Google Pay on my device?,2
4868,Do I get a real card?,43
4869,i live in portugal. do you operate here?,24
4870,Why am I not allowed to transfer money to my cryptocurrency exchange?,7
4871,Why is my withdrawl to cash still pending?,46
4872,Why was I charged a fee for withdrawing money?,19
4873,I can't get money out of the ATM. Is my card actually working? It's the first time I tried using it,26
4874,I tried my PIN too many times,49
4875,How come the money from the merchant appeared back into my account?,53
4876,Why is there a fee added to my statement?,34
4877,How long does it take for my id to verify?,68
4878,When will a transfer from the US post?,67
4879,"I cannot find my phone, what should I do?",42
4880,I can't verify my ID. Why?,68
4881,Does Apple Watch support the topping-off of my account?,2
4882,"My money is gone. I had topped up recently and saw it was there and went through, but now it's disappeared, what is happening?",61
4883,The wrong exchange rate was used when I purchased an item.,17
4884,Can it be delivered on a certain date?,12
4885,Will there be a cost if I exchange currency?,31
4886,Can I change my pin number at a cash machine?,21
4887,Can I get a few more physical cards?,39
4888,What is the price for an additional card?,39
4889,I thought I would have received my new card at this point.,11
4890,I tried using my credit card with top up but it didn't work! I thought it was supposed to?,59
4891,I tried withdrawing but my cash is not showing up?,75
4892,I would like to get some extra cards?,39
4893,This transfer incurred a fee that I don't think is right.,64
4894,I think I am a victim of fraud.  I noticed there was a charge on my account that I didn't do because I haven't touched my card today.  Can you please reverse the charge and refund my money?,28
4895,There is a record of payment I never submitted on the app.,16
4896,How many cards am I allowed?,39
4897,I made a cash withdraw and it shows up as pending why is that?,46
4898,Why hasn't my transaction been completed?,66
4899,Do you also have this extra fee on your statement?,34
4900,Why is there a verification to identity,74
4901,Do I get a card to keep in my wallet?,43
4902,Why are my transfers getting declined?  I havent had a problem in the past.,27
4903,How do I link an existing card?,13
4904,Please check my payment from last Saturday as I feel I have been overcharged on the exchange rate.  Thank you.,17
4905,Is topping up with Apple Pay possible?,2
4906,How often am I able to top-up?,60
4907,Tell me why my balance did not change when I tranferred cash.,5
4908,I tried to charge my card but it was declined. A couple days ago I was able to charge it and it was accepted. Is something wrong? Will you double check for me please?,59
4909,In which stores can I shop with this card?,10
4910,"Hi there, I've tried to make a transfer 5 different times and its not working. Is your system down or something?",35
4911,Was there a way for me to get tracking for that?,11
4912,May I get one of your cards?  I live in the EU.,24
4913,I'm wanting to get a Visa card today.,73
4914,What other currencies are available to change to?,33
4915,Why isn't my cash deposit showing up in my account? I deposited it this morning.,6
4916,How long does a transfer from the US take?,67
4917,"I bought something in another currency, but the exchange rate was incorrect.",17
