,text,label
2242,How long does it take for a card to arrive?,12
2243,I want to get a virtual card!,40
2244,Did I not get my refund? I don't see it.,51
2245,I ordered online weeks ago and I never received my package in the mail and I don't want to wait any more. So if I could get my money back now that would be great.,52
2246,I want to reverse a transaction I did this morning,8
2247,Are cards available to those outside of the UK?,24
2248,I tried to pay through my account but the payment is not going through. What's going on?,45
2249,My phone has been lost or stolen,42
2250,My card is due to expire,9
2251,I want to top up by card,62
2252,The money is still in my account even though I already paid -- I don't understand what happened.,53
2253,Where is my top-up generated from?,70
2254,What locations are cards delivered to?,43
2255,Why can't I use my card?,14
2256,My recipient hasn't received the money,66
2257,How do I top up?,65
2258,I prefer to get a Mastercard.,73
2259,"Why does the ATM continually decline my card? I've tried multiple times on different machines with the same results. I thought I had enough funds for this, so please help me understand why this is happening.",26
2260,I was declined when trying to withdrawal cash!,26
2261,Can you show me how to verify the top-up card?,71
2262,Are there downsides to using a disposable virtual cards?,29
2263,I do not recognise this card payment.,16
2264,"There was money taken out of my account, and I'm pretty sure I didn't do it.",20
2265,"I need to change my name, since i just got married",30
2266,what is going on with my cash withdrawal? the exchange rate is wrong,76
2267,My app shows a payment I didn't make,16
2268,I have a new card and need to activate it,0
2269,I did a cash deposit to my account but it doesn't show up,6
2270,What forms of ID do you need for identity verification?,69
2271,Do all ATMs accept this card?,3
2272,Where do I order additional cards?,39
2273,I've been waiting for over an hour for a top up to go through.  How long is this supposed to take?  I really need this money.,47
2274,"On a card top-up, where can I verify?",71
2275,"You can do that in just a few seconds. Go to account, hit activate, and follow the directions from there.",0
2276,Can I change my pin at an atm?,21
2277,Help! I need to cancel a transaction.,8
2278,How can I fix my bank transfer to show up on my bank account?,5
2279,"If my top-up didn't transfer, what went wrong?",61
2280,I deactivated my card but would like to reactivate it.,13
2281,What are the disposable card limits?,29
2282,In which countries does your app work,24
2283,Why was my top-up rejected?,59
2284,Can I tell what business will take this card?,10
2285,What is the process to activate a card,0
2286,What is wrong with my top-up?,47
2287,Why would my payment still show as pending?,45
2288,What is taking so long with my refund?,51
2289,"your company is awful, i would like to delete my account please",55
2290,I'm not happy with service and would like to delete this account.,55
2291,What is the max top-up?,60
2292,I got a message that my transfer is not possible.  What is happening?  I need this to go through please.,7
2293,My cash withdrawal was not entirely complete,75
2294,Where can I find the top up verification code?,71
2295,"I saw money was taken out of my account by a seller a while back. I do not recognize the seller, but I'm pretty certain I didn't make that payment. Can you track who the seller is?",28
2296,phone is gone,42
2297,Will the PIN come separately?,38
2298,Can I request a refund,52
2299,Explain how to verify my identity?,69
2300,Problems with my top up,59
2301,I left my card at a restaurant and now its missing.,41
2302,Why would I receive an error that my transfer isn't possible when I've done it before?,7
2303,Where are your cards delivered to?,43
2304,What caused my transfer to fail?,35
2305,What is this extra pound charge for?,34
2306,Where is the top-up verification code located?,71
2307,Why can I not make a transfer?,35
2308,Since when were there charges for taking out cash from my account? It's always been free for me to do this before.  How much are the charges going to be?,19
2309,I am locked out from entering my pin.,49
2310,I need help- I got mugged yesterday and they took everything so I can't use the app.,42
2311,Will you accept my salary if it's in another currency?,50
2312,Show me how to look at the source of my current funds?,70
2313,"There are a couple payments with my card shown in the app that i really didn't make myself. What's going on with this, does someone has access to my card?!",16
2314,Can you please check my UK Account to make sure everything went alright?  I made the transfer a couple of hours ago.,5
2315,A card payment on my account is shown as pending.,45
2316,What if there is an error on the exchange rate?,17
2317,I need to verify my funds.,70
2318,I have some transactions on my account I did not make. Can you cancel my card and prevent further use.,22
2319,"I was supposed to receive my new card by now, but it hasn't came in.",11
2320,i don't see the top-up verification code anywhere,71
2321,Can you tell me why my top-up was canceled?,61
2322,how long does a US transfer take,67
2323,"Can you help me with my card, I think it's broke.",14
2324,Do you know the process how to activate my card?,0
2325,how come my withdrawal rate is wrong for my cash withdrawal,76
2326,want to get a new card in china,9
2327,Is there a way to lookup where funds came from?,70
2328,Are there any restrictions on where I use this card?,10
2329,Can I change my PIN at any ATM?,21
2330,what amount of time does it take for a transfer to reflect and be available,5
2331,Which merchants accept this card?,10
2332,Help me. My transfer was declined. How could this happen?,27
2333,"I needed to send my friends some money urgently.  I tried multiple times to transfer the money this morning, but the transfer keeps failing.  Can you tell me why the transfer is getting rejected?",35
2334,I have a withdrawal waiting to go through.,46
2335,My currency rate is inaccurate.,17
2336,I added money to the card but the transaction didn't go through,47
2337,What businesses accept this card?,10
2338,Is there anyway to use a cheque to top up?,58
2339,Please tell me the types of currency I can hold.,36
2340,I'll send a check to top up my account,58
2341,What caused my top up to be reverted?,61
2342,Why hasn't my in country transfer gone through yet? I confirmed the account info a couple days ago but the payment hasn't been posted yet.,66
2343,My payment has been declined several times.  Can you help me?,25
2344,Please tell me how to verify my top up card.,71
2345,I need a new card before it expires.,9
2346,"my card payment has been declined, do you know why?",25
2347,I don't recognize some transactions.  Is someone else using it?,22
2348,Can I use my American Express card with Apple Pay?,2
2349,My card payment might have been reverted.,53
2350,I requested $100 but only got $20,75
2351,the exchange rate at which my card payment is at is wrong,17
2352,"I put money into my account in the form of a cheque, but my balance did not change.",6
2353,Why would my card payment be cancelled?,53
2354,The exchange rate is bad. Are you sure this is the exchange rate?,17
2355,How do I get refills to my card when I'm traveling?,4
2356,How can I exchange currencies with this app?,33
2357,The ATM didn't give me what I asked for but my balance says it did,75
2358,Why am I being charged for ATM fees?,19
2359,Can I change my PIN without going to a bank branch?,21
2360,"new customer and filling gas for the first time today, not working,",47
2361,What am I going to need in order to verify my identity?,69
2362,Is it possible to get a card outside the UK?,24
2363,I need to transfer money into this account from my other bank account.,65
2364,Can someone in the US have a card?,24
2365,What are the sources for the funds in my account?,70
2366,"I need to make a transfer from Europe, how many days does this take?",67
2367,I have lost my credit card in the ATM!,18
2368,Do you have any top-up limits?,60
2369,I tried to transfer money but it didn't go through,35
2370,Why hasn't my transaction arrived to my friend yet?,66
2371,How long would does it take for a seller to receive an EU transfer if I bought something from them and sent them the money immediately?,48
2372,Do you do business in the EU?,24
2373,why don't you accept american express for adding money to my account,54
2374,Please show me how my friend can send me money.,50
2375,I see a duplicate payment.,63
2376,What is the normal time to make an international transfer? I made one a few days ago that still hasn't arrived.,5
2377,Please tell me if I'm going to be charged for sending out more cards?,39
2378,Using international ATMs messes up the exchange rate.,76
2379,There's a payment in the app that I didn't authorize.,16
2380,Are there ATM fees?,19
2381,A direct debit appears in the app but I didn't authorize it.,28
2382,"I only made one transaction at this place, but it's appearing multiple times.",63
2383,Can someone explain why I'm getting a message on my screen saying my transfer isn't possible? I've done several in the past and haven't had a single problem until now. What's going on?,7
2384,I was informed that transfers were free. I noticed I have a fee but why?,64
2385,Google Pay isn't working. What is wrong?,2
2386,why do you charge for transfers?,56
2387,Explain the activation method for this card,0
2388,My card is needed soon,12
2389,There's a card payment with a name I don't recognize,16
2390,Can I top off with a debit card?,54
2391,"I'm trying to verify my top-up card, but I can't find the code...?",71
2392,Is there a limit on making disposable cards?,29
2393,i would like to top up with check,58
2394,Any chance of getting the card outside the UK?,24
2395,I can't see a refund for a return I completed recently.,51
2396,What if I need my salary in another currency?,50
2397,"I've used my account frequently over the last month to manage my payments from abroad for my new place. I noticed that my fees have suddenly increased. As a frequent customer, shouldn't I be rewarded rather than suddenly being subject to a new fee?",64
2398,I need a Visa card,73
2399,My card won't work right now.,14
2400,"I paid with my card and got charged an extra fee, what's up with that?",15
2401,My top-up has not posted.,47
2402,"Hi, I am experiencing problems while trying to top-up with my card. I have never experienced any problems doing this before. Could you please help me?",59
2403,I want to know where my money comes from.,70
2404,Why would my card payment get reverted?,53
2405,What do I do to verify my source of funds?,70
2406,Do all businesses take this card?,10
2407,I make payments for my place abroad using this account and since i use it so frequently I was wondering why did the fees increase suddenly rather than decreasing? I would think customers like me should receive incentives for using your service,64
2408,I had a dollar charged to my account that's still pending and wanted to know what the charge is for?,34
2409,What do I need to do to link my new card for my account?,13
2410,I just looked over my statement and I don't recognize the name of a card payment.,16
2411,Can it automatically top up my account?,4
2412,"I would like open a second card for my daughter, how can you assist me?",39
2413,Where can I find out how to transfer money into my account.,65
2414,My cash transaction isn't showing on my receipt,66
2415,Where is this card accepted?,10
2416,How do I check to see why my card payment was declined?,25
2417,How much is the exchange fee?,31
2418,How do I edit the personal details on my account?,30
2419,"I got less than what i asked for in the ATM, why?",75
2420,Can you tell me where  can change my PIN?,21
2421,I just saw a fee on my account. When do these get charged?,15
2422,i have been trying to top up my account with a check but it won't work,58
2423,Please help me change my PIN.,21
2424,There is a debit transaction on my statement that I did not make,28
2425,Why is this payment on my app,16
2426,Tell me how to setup a new PIN.,21
2427,A mortgage payment I'm making is giving me an error message.  This is the first time I'm making this payment and want to know what's wrong.,35
2428,Is there an age limit to when my child can use these services?,1
2429,Is this card available to Americans?,24
2430,is there a reason that my payment didnt go through,25
2431,Is my card ready for use or does it need activated and if so how?,0
2432,how do I know where I can get money withdrawn?,3
2433,How do I replace a card that's going to expire?,9
2434,Can you help me find the virtual card?,40
2435,My transfer is failing when I try to do it.,35
2436,How to verify my identity,74
2437,Can I use the app without my phone?,42
2438,What is the procedure for activating this card?,0
2439,I don't understand why I was charged extra for withdrawing money?,19
2440,How can I tell what foreign exchange rate I will get?,32
2441,"I need a new card to replace an expired one. Will it cost anything, and how soon?",9
2442,Why wont the ATM give me cash?,26
2443,I need to order a new card.,43
2444,Can I get a disposable virtual card?,37
2445,"It's declining my transfers. Normally this works, but my card is being declined now and I've tried more than once.",27
2446,I made a transfer from France a couple days ago and don't see the transaction yet. How long does an international transfer take?,5
2447,Today I was out eating and my card was declined. Why's that?,14
2448,Changing my PIN,21
2449,I need immediate assistance in canceling a transfer which was a mistake. Please help me quickly so this does not go through.,8
2450,I don't see a money transfer yet,48
2451,Can friends I have top-up my account?,62
2452,Do you accept US credit cards?,54
2453,Why can't I get cash out?,26
2454,How much are the fees for adding funds using an international card?,57
2455,"Hi, can you tell me why my transfer keeps being rejected? I've been trying to send money to my friends this morning but failed every time and I have no idea why?",35
2456,do i need to wait for my card before i get pin,38
2457,"I draw out money from your ATM during holidays, and was charged insanely. I wouldn't have done it, if i had a little sense about the shocking charges.",76
2458,"I attempted to complete a topup, and I thought all was well, but now the money is gone again. Has there been a glitch?",61
2459,I think my top up is still pending?,47
2460,How do I link my card in the app.,13
2461,can I have multiple currencies?,36
2462,The card has suffered a security breach.,22
2463,I want to use my account before identity verification,74
2464,Hoe do i use my credit card to transfer money?,62
2465,Is there a way to get a virtual card?,40
2466,I am afraid to give you all my identify details.,74
2467,What on earth is up with the exchange rate! This should have been a much higher amount of cash,76
2468,I really want a physical card. How do I get one?,43
2469,I believe you charged me too much to exchange my money,17
2470,"I took out cash from the ATM, but something must have went wrong, My account shows the correct amount of cash I took out, but the ATM didn't give me that amount. How do I get my money back?",75
2471,Why has my withdrawal not posted?,46
2472,I am having problems with a top-up.,59
2473,What are the benefits of a disposable card?,37
2474,I did not charge my account for that transaction.  That's an error.,16
2475,The correct exchange rate wasn't given to me for an item I purchased.,17
2476,how to get card pin?,38
2477,I made a transfer to my friend earlier and she hasn't received it yet.  What's the hold up?,66
2478,I've been charged an extra £1 and I don't know why,34
2479,"I made a deposit a couple of days back it's, as of yet, not gone in! It would be ideal if you assist me with this",6
2480,I was charged several times for something,63
2481,I'd prefer Mastercard.,73
2482,Can I write a cheque to top up?,58
2483,WHAT IS THE SOLUTION OF THIS PROBLEM,11
2484,"I received the wrong color and size, can I return it?",52
2485,How many currencies can I have?,36
2486,"went somewhere else, need to change details",30
2487,"I am tired of getting charged fees, and I have no idea why, please let me know what/when you charge fees for.",15
2488,Someone might be using my card.  What should I do?,22
2489,Does the fee for exchange change?,17
2490,I can't find the card PIN.,38
2491,What factors determine your exchange rate?,32
2492,I see a direct debit payment on my app that I did not do,28
2493,Where do I have access to a virtual card?,40
2494,There is a card payment that I'm not recognizing.,16
2495,I would like to change currency,33
2496,why do you verify the top up,71
2497,"Sort your top up out please! It's been pending since an hour already, can you please make this go through asap I really need the money",47
2498,Who gets support?,24
2499,Can topping up be automatic?,4
2500,"With this app, will I be able to exchange currency?",33
2501,"My ATM transaction shorted me on cash, and I think the exchange rate was wrong. Did I receive the correct rate?",76
2502,Can you explain why my transfer was unsuccessful?,35
2503,I only got $20 of the $100 that I attempted to withdraw.,75
2504,Can I add money to my card automatically during a trip?,4
2505,I got some cash out of the ATM over the holiday and it seems that I've been grossly overcharged. I wouldn't have done that if I knew of these outrageous charges!,76
2506,Can I give a second card for this account to my daughter?,39
2507,how do i get a new card,43
2508,how do I find the code to verify the top up card?,71
2509,"I topped-up my account, but I don't think it went through.",47
2510,Why are you charging me for ATM withdrawal? It has always been free before.,19
2511,I know there's an auto-top option but I can not locate it when I look?,4
2512,"I Withdrew cash from an ATM earlier but it shows up as pending in the app. How can this still be pending, I received the cash already?",46
2513,I couldnt transfer money from my account.,35
2514,I have been travelling overseas and I need to change my PIN. Can you tell me how this is done?,21
2515,I'm still waiting for the top-up!,47
2516,When will my new card be delivered?,11
2517,"I didn't want to make a transaction, I want to revert it",8
2518,I thought it was free to make a withdrawal. So how much does it cost now?,19
2519,Is there a charge for getting my money?,56
2520,How long does a transfer from the UK account usually take? After completing the transfer it is not showing up. I need to know that everything I actually went okay.,5
2521,Will I receive all the money sent to my account by SEPA transfer?,56
2522,"In the app, I see a withdrawal I didn't make.",20
2523,Can cards be delivered? Where?,43
2524,Why didn't my transfer to a beneficiary happen?,7
2525,I cannot see a refund in my account,51
2526,The balance has not been updated.,5
2527,I need to delete my account.,55
2528,what countries can i use my card in,24
2529,Help me order my card.,43
2530,I want to cancel my account.,55
2531,I exchange currencies a lot.  Can I get a discount?,31
2532,Help me unblock my PIN.,49
2533,I would like to use this cheque to top up.  Can you tell me how to do that?,58
2534,Top up did not work on the app.,59
2535,What is delivery speed to the United States?,12
2536,Why has my card payment been reversed?,53
2537,What was the extra charge for withdrawing money?,19
2538,Can you find out why my credit card didn't process payment? It was declined for top up so what's the deal?,59
2539,"The company is no good, please terminate my account.",55
2540,How long does it take to make an urgent transfer from China?,67
2541,The exchange rate for foreign ATM currency is wrong.,76
2542,I can't see the transfer that I put in.,5
2543,what are your exchange rates at?,32
2544,"I'm waiting for a transfer from the US, how much longer?",67
2545,I bought something online a week ago and i never got it in the mail.Can I just get my money back now I don't want to keep waiting on something that isn't going to show up.,52
2546,I think someone may have cloned my card or something.  My card isn't lost but I just saw a charge of $500 cash withdraw.  Can you help me?,20
2547,Where is my new card if I haven't received it yet?,11
2548,Someone stole my wallet with my card in it while vacationing in Spain. I really need my card blocked and a new one ordered.,41
2549,Where do I get a disposable card,37
2550,I am very upset that i went to use my new card today and it kept getting declined. Why is this happening and what do I do to not have it declined?,25
2551,Will I be charged for receiving the money?,56
2552,Why am I being charged fees on some transactions but not on others? What am I missing here? I cannot find where to see the fee structure on my account. Help!,15
2553,Can you tell me if I can track the card you sent me?,11
2554,Why hasn't my transaction arrived?,66
2555,I think someone stole money from my card,20
2556,There was a direct debit I don't recognize.,28
2557,How can I put more money into my account?,58
2558,Can I add a card back to the app?,13
2559,Is my PIN recorded anywhere?,38
2560,I made a transfer and the person I transferred the money to didn't receive the right amount? Why did this happen and how do I get the rest of the money to them?,64
2561,How much am I allowed to top-up?,60
2562,Can you tell me why I was charged $1 for a transaction?,34
2563,"My new card has arrived, what's the activation procedure?",0
2564,How can I receive a virtual card?,40
2565,Can I have a tangible form of my virtual card.,43
2566,I got charged two times for a transaction,63
2567,Is there a charge for exchanging foreign currency?,31
2568,What is the process to change my PIN?,21
2569,Why was I charged a fee on a cash withdrawal?,19
2570,how to exchange currencies,33
2571,Is there a way to link the card i just got?,13
2572,Why was my card declined in a shop?,25
2573,I was charged an extra pound for no reason. Why is that?,34
2574,Please help me find my top-up verification code,71
2575,Please cancel my last transaction.,8
2576,I did a card payment but its status is still coming as pending. Please check and inform when it would complete.,45
2577,"I need to transfer some money, can I use my credit card?",62
2578,Is there a cost to receive money?,56
2579,Can I use my account although my identity verification has yet to pass?,74
2580,When does a UK transfer show up?,5
2581,Why hasn't my transfer from Europe gone through?,67
2582,I am looking for my top-up verification code and cannot find it.,71
2583,Is the fee with my cash withdrawal a mistake?,19
2584,hello I have lost my phone and I'm worried someone's going to steal money from me,42
2585,Can I get information on the identity checks?,69
2586,I've tried completing a very standard transfer and have already attempted it 5 times. What's going on here? Is there a problem with your system?,35
2587,How do I validate my identity.,69
2588,How do I get my card?,43
2589,Do you have any accounts for children ?,1
2590,I used an ATM and wanted to know why I was charged an extra fee.,19
2591,How much does each transfer cost?,56
2592,Why is verifaction required for my Identity?,74
2593,Why is top-up verified?,71
2594,Why should I verify the top-up?,71
2595,"For you, how long do transfers normally take from a UK account? I completed one just now but nothing appears. I just need to be sure everything is okay.",5
2596,I have a payment that has not gone through yet,45
2597,Which foreign currencies can I get transferred into my account?,50
2598,Where would I order a virtual card?,40
2599,"How do I know if I will get my card, or if it is lost?",11
2600,Why are top-ups being verified?,71
2601,Are there any extras for exchanging currency?,31
2602,What do I need to do to verify my funds?,70
2603,I got a strange cash withdrawal in my statement,20
2604,There are some charges that I don't recognize.  It happened days ago.  Can I get these charges back?  Should I cancel my card?,16
2605,"my card details could be stolen, as i didnt make these transactions",22
2606,I am not receiving the correct exchange rate on my card.,17
2607,I need a refund. This is not what i wanted.,52
2608,Will you charge an extra fee for top ups?,57
2609,"I am calling because the ATM didn't give me the right amount of cash, but my app shows the actual amount I wanted to withdraw. What should I do to get my money back?",75
2610,"If I want to topup by card, how do I do it?",54
2611,Which ATMs accept Mastercard?,3
2612,"how many virtual cards can i have, i want 8",40
2613,I have to make more then a few disposable cards per day.,29
2614,I think the exchange rate for the cash I withdrew was wrong.,76
2615,I can't find the auto-top up option.,4
2616,How long does it actually take my card payment to make it to the account? I've made a payment a couple of days ago but it hasn't moved since.,45
2617,How do I use a check to top up?,58
2618,"I have been charged to much for the object I bought when abroad, the exchange rate seems to be wrong.",17
2619,My ATM withdrawal is taking forever,46
2620,What fiduciary currencies are supported for tenure and exchange?,36
2621,My card payments have stopped.,53
2622,What should I do with my stuck ATM?,18
2623,Can I use my card in another institutions ATM?,3
2624,I've tried several times to make a payment and every time my card is declined? Could my card be locked? I don't know what to do.,25
2625,Is there a charge for using an European bank card for top up?,57
2626,I have been trying to make a transfer and it won't go through. I have checked all the receipts and its all correct but still won't let me do it.,27
2627,"This company is bad, delete my account now.",55
2628,I still don't have a card. How do I get one?,43
2629,What do I do if my card was stolen.,41
2630,Is there a charge for using transfers for top ups?,56
